Question,Answer
How do I download my checking statements from the mobile app?,"Open the app, go to Accounts, select your account, tap Statements, choose the month, and click Download PDF. Ensure you have a PDF viewer."
How do I transfer funds to another savings account?,"Log into online banking, go to Transfers, enter the recipients account details, and confirm. Transfers typically process within 1 business day."
What are the benefits of your insurance plan?,Our insurance plan offers personalized portfolio management. Contact us at 18005554321 for a full list of benefits tailored to your needs.
Can I change the payment due date for my loan?,"Yes, contact our loan team at 18005556789 to request a change. Some restrictions may apply based on terms."
How do I set up automatic credit card payments?,"Log into online banking, go to Bill Pay, select Auto-Pay Setup,  choose payee, amount, and schedule. You will receive a confirmation."
Can I change the payment due date for my credit card?,"Yes, contact our credit card team at 18005556789 to request a change. Some restrictions may apply based on terms."
How can I increase my credit card limit?,"To request a limit increase, call 18005551234 or submit a request online. We will review your account and credit history."
What are the fees for your investment service?,Our investment service charges a 0.5 percent annual fee based on assets. No additional trading fees for standard portfolios. Want a detailed schedule?
Why was my mortgage application denied?,"Denials may occur due to credit score, debt-to-income ratio, or incomplete documents. Contact our mortgage team at 18005555678 for details."
Can I apply for a mortgage online?,"Yes, visit the mortgage section on our website, complete the form, and upload documents. A representative will follow up within 2 business days."
What documents are required to open a checking account?,"You will need a government-issued ID, proof of address, and Social Security number. Visit our website or a branch to start the process."
Why was my loan application denied?,"Denials may occur due to credit score, debt-to-income ratio, or incomplete documents. Contact our loan team at 18005555678 for details."